title,url,snippet,source,position,search_query,category,perspective,collection_timestamp
What's in the 2025 Reconciliation Bill So Far?,https://www.americanimmigrationcouncil.org/fact-sheet/house-reconciliation-bill-immigration-border-security/,"Overall, the Senate and House of Representatives bills provide dramatic funding increases to immigration- and border enforcement-related funding ...",,5,Republican border security and immigration enforcement,pro_republican,republican_perspective,2025-07-08T19:23:59.278020
House Republican budget bill gives Trump $185 billion to carry out ...,https://www.epi.org/blog/house-republican-budget-bill-gives-trump-185-billion-to-carry-out-his-mass-deportation-agenda-while-doing-nothing-for-workers-immigration-enforcement-would-have-80-times-more-funding-than-la/,House Republican budget bill would give Trump $185 billion for immigration enforcement—80 times more than for protecting labor standards ...,,6,Republican border security and immigration enforcement,pro_republican,republican_perspective,2025-07-08T19:23:59.278023
The collapse of bipartisan immigration reform - Brookings Institution,https://www.brookings.edu/articles/the-collapse-of-bipartisan-immigration-reform-a-guide-for-the-perplexed/,"Many Republicans are using the border security bill the House passed early last year, HR 2, as their benchmark. Republicans are prepared to ...",,7,Republican border security and immigration enforcement,pro_republican,republican_perspective,2025-07-08T19:23:59.278026
How the GOP Megabill Would Turbocharge Local Immigration ...,https://boltsmag.org/how-the-gop-megabill-would-turbocharge-local-immigration-enforcement/,"The bill would massively scale up immigration detention facilities to the tune of $45 billion over five years, help recruit thousands of new ...",,8,Republican border security and immigration enforcement,pro_republican,republican_perspective,2025-07-08T19:23:59.278029
Text - H.R.2 - 118th Congress (2023-2024): Secure the Border Act of ...,https://www.congress.gov/bill/118th-congress/house-bill/2/text,"—In carrying out this section, the Secretary of Homeland Security shall deploy along the southwest border the most practical and effective technology available ...",,9,Republican border security and immigration enforcement,pro_republican,republican_perspective,2025-07-08T19:23:59.278032
Expanding Educational Freedom and Opportunity for Families,https://www.whitehouse.gov/presidential-actions/2025/01/expanding-educational-freedom-and-opportunity-for-families/,It is the policy of my Administration to support parents in choosing and directing the upbringing and education of their children.,,1,School choice initiatives and education freedom,pro_republican,republican_perspective,2025-07-08T19:24:01.452643
Department of Education Encourages States to Expand Education ...,https://www.ed.gov/about/news/press-release/department-of-education-encourages-states-expand-education-choice-leveraging-flexibilities-title-i-funds?ref=tippinsights.com,“Today's guidance is an important early action aimed at advancing educational choice and encouraging states and schools to maximize learning ...,,2,School choice initiatives and education freedom,pro_republican,republican_perspective,2025-07-08T19:24:01.452671
[PDF] PROTECTING EDUCATIONAL FREEDOM: - Advance Colorado,https://www.advancecolorado.org/wp-content/uploads/2024/07/PROTECTING-EDUCATIONAL-FREEDOM-1-compressed-1.pdf,"School choice in Colorado has a decades-long record of popularity among families and educators, opening doors for students to choose schools that.",,3,School choice initiatives and education freedom,pro_republican,republican_perspective,2025-07-08T19:24:01.452675
5 benefits of school choice in education - Americans for Prosperity,https://americansforprosperity.org/blog/benefits-of-school-choice-for-both-students-and-teachers/,"Through school choice, we can improve student outcomes, enhance parental satisfaction, and create a more dynamic, innovative education system.",,4,School choice initiatives and education freedom,pro_republican,republican_perspective,2025-07-08T19:24:01.452678
ACF: How Early Learning Programs Align With Executive Order on ...,https://www.ffyf.org/resources/2025/05/acf-how-early-learning-programs-align-with-executive-order-on-school-choice/,"... Educational Freedom and Opportunity for Families. Signed on January 29th, this EO seeks to expand school choice through federal programs.",,5,School choice initiatives and education freedom,pro_republican,republican_perspective,2025-07-08T19:24:01.452701
School Choice: The Battle for Parental Rights and Educational ...,https://capitalresearch.org/article/school-choice-the-battle-for-parental-rights-and-educational-freedom/,The order encourages states with existing school choice programs to expand their voucher and scholarship initiatives by allowing federal funds ...,,6,School choice initiatives and education freedom,pro_republican,republican_perspective,2025-07-08T19:24:01.452705
The 2025 ABCs of School Choice is Available Now - EdChoice,https://www.edchoice.org/the-2025-abcs-of-school-choice-is-available-now/,The 2025 ABCs of School Choice introduces a new universal framework to better evaluate the impact and reach of educational choice programs.,,7,School choice initiatives and education freedom,pro_republican,republican_perspective,2025-07-08T19:24:01.452708
School Choice Week: Why educational freedom works for all,https://thelibreinitiative.com/blog/school-choice-week-educational-freedom-works-for-all/,"With school choice on the rise, this is a great moment to take a quick refresher on why The LIBRE Initiative supports educational freedom — and ...",,8,School choice initiatives and education freedom,pro_republican,republican_perspective,2025-07-08T19:24:01.452711
[PDF] Expanding Educational Freedom and Opportunity for Families,https://www.cbcfinc.org/wp-content/uploads/2025/03/Expanding-Educational-Freedom-and-Opportunity-for-Families.pdf,"This order expands school choice programs by encouraging states to use federal funds to support K-12 educational choice initiatives, including charter schools, ...",,9,School choice initiatives and education freedom,pro_republican,republican_perspective,2025-07-08T19:24:01.452713
Freedom to Learn: The Tenacious Fight for Educational Choice,https://www.cato.org/free-society/freedom-learn-tenacious-fight-educational-choice,Families across the country are taking advantage of new school choice programs that fund students and help them access education that fits their ...,,10,School choice initiatives and education freedom,pro_republican,republican_perspective,2025-07-08T19:24:01.452716
How Republicans Re-engineered the Tax Code - The New York Times,https://www.nytimes.com/2025/07/04/us/politics/republicans-tax-code-trump.html,"Essentially, the goal was to excise as many loopholes and special deductions from the tax code as possible, increasing the amount of income ...",,1,Republican tax reduction and fiscal responsibility,pro_republican,republican_perspective,2025-07-08T19:24:03.783180
By the Numbers: House Republican Tax Agenda Favors the Wealthy ...,https://www.cbpp.org/research/federal-tax/by-the-numbers-house-republican-tax-agenda-favors-the-wealthy-and-leaves,"The House Republican reconciliation bill would give huge tax breaks to wealthy individuals, businesses, and large corporations while leaving behind or raising ...",,2,Republican tax reduction and fiscal responsibility,pro_republican,republican_perspective,2025-07-08T19:24:03.783211
What's in the 2025 House Republican Tax Bill,https://bipartisanpolicy.org/explainer/whats-in-the-2025-house-republican-tax-bill/,"Provides an extra inflation adjustment to the standard deduction, which results in lower tax bills for taxpayers taking the standard deduction.",,3,Republican tax reduction and fiscal responsibility,pro_republican,republican_perspective,2025-07-08T19:24:03.783216
"Republicans used to be the fiscally conservative party, but look at us ...",https://idahocapitalsun.com/2025/07/03/republicans-used-to-be-the-fiscally-conservative-party-but-look-at-us-now/,"On Tuesday, after 23 hours of debate, the Republican Senate passed a bill that cuts taxes by $4.5 trillion, increases the national debt by at ...",,4,Republican tax reduction and fiscal responsibility,pro_republican,republican_perspective,2025-07-08T19:24:03.783220
What the Senate Republican 'big beautiful' bill means for your money,https://www.cnbc.com/guide/the-big-beautiful-bill-act-senate-republican/,"If enacted, the bill could also slash spending on social safety net programs such as Medicaid and SNAP, end tax credits tied to clean energy and ...",,5,Republican tax reduction and fiscal responsibility,pro_republican,republican_perspective,2025-07-08T19:24:03.783223
"Senate Republicans pass Trump tax bill with Medicaid, SNAP cuts",https://www.npr.org/2025/07/01/nx-s1-5450367/senate-republicans-trump-tax-bill-medicaid,"The Republican megabill cuts trillions in taxes, while scaling back spending on Medicaid and other federal programs.",,6,Republican tax reduction and fiscal responsibility,pro_republican,republican_perspective,2025-07-08T19:24:03.783226
The radical Republican budget bill steals from the poor to give tax ...,https://www.epi.org/blog/the-radical-republican-budget-bill-steals-from-the-poor-to-give-tax-cuts-to-the-rich/,The bill is designed to cause a shocking upward redistribution of income. It includes draconian spending cuts—mostly to health care and food ...,,7,Republican tax reduction and fiscal responsibility,pro_republican,republican_perspective,2025-07-08T19:24:03.783230
"Americans' views of GOP budget and tax bill, 'One Big Beautiful Bill'",https://www.pewresearch.org/short-reads/2025/06/17/how-americans-view-the-gops-budget-and-tax-bill/,"Americans are broadly skeptical of the GOP's far-reaching budget and tax bill, according to a Pew Research Center survey conducted June 2-8, 2025.",,8,Republican tax reduction and fiscal responsibility,pro_republican,republican_perspective,2025-07-08T19:24:03.783233
Budget Reconciliation: Tracking the 2025 Trump Tax Cuts,https://taxfoundation.org/research/all/federal/trump-tax-cuts-2025-budget-reconciliation/,Cuts and Jobs Act (TCJA) would decrease federal tax revenue by $4.5 trillion from 2025 through 2034. Long-run GDP would be 1.1 percent higher.,,9,Republican tax reduction and fiscal responsibility,pro_republican,republican_perspective,2025-07-08T19:24:03.783236
Republican Agenda's “Triple Threat” to Low- and Moderate-Income ...,https://www.cbpp.org/research/federal-tax/republican-agendas-triple-threat-to-low-and-moderate-income-family-well-being,"The House-passed budget resolution calls for $4.5 trillion of tax cuts over the fiscal year 2025-2034 budget window, more than enough to cover ...",,10,Republican tax reduction and fiscal responsibility,pro_republican,republican_perspective,2025-07-08T19:24:03.783239
2nd Amendment Republican Party - Riverside County GOP,https://www.riversidecountygop.com/republican-issues-in-riverside-county/2nd-amendment-republican-party/,"We uphold the right of individuals to keep and bear arms, a natural inalienable right that predates the Constitution and is secured by the Second Amendment.",,1,Second Amendment protections in Republican platform,pro_republican,republican_perspective,2025-07-08T19:24:06.037416
Republican Party guns platform: GOP politicians talk ... - USA Today,https://www.usatoday.com/story/news/politics/elections/2024/10/04/republican-party-gun-control-rights-platform/75494948007/,The Republican Party's 2024 platform makes little mention of gun rights or the Second Amendment beyond saying that the party would protect “THE RIGHT TO KEEP ...,,2,Second Amendment protections in Republican platform,pro_republican,republican_perspective,2025-07-08T19:24:06.037447
2024 Republican Platform Drops Gun-Rights Promises - The Reload,https://thereload.com/2024-republican-platform-drops-gun-rights-promises/,The Republican National Committee (RNC) Platform Committee voted 84-to-18 on Monday to adopt the new 2024 platform language after skipping the process entirely ...,,3,Second Amendment protections in Republican platform,pro_republican,republican_perspective,2025-07-08T19:24:06.037452
[PDF] Gun Control: Republican Views for Common Ground,https://scholarworks.waldenu.edu/cgi/viewcontent.cgi?article=12582&context=dissertations,There is a view among American political analysts that Republicans tend to favor the laws that block laws likely to place limits on gun ownership while the ...,,4,Second Amendment protections in Republican platform,pro_republican,republican_perspective,2025-07-08T19:24:06.037455
Protecting Second Amendment Rights - The White House,https://www.whitehouse.gov/presidential-actions/2025/02/protecting-second-amendment-rights/,"By the authority vested in me as President by the Constitution and the laws of the United States of America, it is hereby ordered: Section ...",,5,Second Amendment protections in Republican platform,pro_republican,republican_perspective,2025-07-08T19:24:06.037458
2024 Republican Party Platform - The American Presidency Project,https://www.presidency.ucsb.edu/documents/2024-republican-party-platform,2024 GOP PLATFORM: MAKE AMERICA GREAT AGAIN! Dedication: To the Forgotten Men and Women of America PREAMBLE America First: A Return to Common Sense.,,6,Second Amendment protections in Republican platform,pro_republican,republican_perspective,2025-07-08T19:24:06.037462
The 2024 GOP Platform Barely Mentions the Second Amendment,https://reason.com/2024/07/10/the-2024-gop-platform-offers-only-a-passing-reference-to-the-second-amendment/,"The party's neglect of the issue is consistent with its domination by Donald Trump, who pays lip service to gun rights but has never been a ...",,7,Second Amendment protections in Republican platform,pro_republican,republican_perspective,2025-07-08T19:24:06.037465
Key facts about Americans and guns - Pew Research Center,https://www.pewresearch.org/short-reads/2024/07/24/key-facts-about-americans-and-guns/,"About six-in-ten U.S. adults (58%) favor stricter gun laws. Another 26% say that U.S. gun laws are about right, while 15% favor less strict ...",,8,Second Amendment protections in Republican platform,pro_republican,republican_perspective,2025-07-08T19:24:06.037468
Gun rights advocates at Republican convention spell out plans if ...,https://missouriindependent.com/briefs/gun-rights-advocates-at-convention-spell-out-plans-if-gop-gains-control-in-november/,Republicans speaking at a concealed carry event on Tuesday insisted the party won't change its stance on Second Amendment rights.,,9,Second Amendment protections in Republican platform,pro_republican,republican_perspective,2025-07-08T19:24:06.037470
House Republicans Are Defending Americans Second Amendment ...,https://www.gop.gov/news/documentsingle.aspx?DocumentID=587,"This is a gun ban that deprives the citizens of New Mexico of their Constitutional right to bear arms. FACTS ABOUT H. RES. 684, CONDEMNING THE ...",,10,Second Amendment protections in Republican platform,pro_republican,republican_perspective,2025-07-08T19:24:06.037474
How the G.O.P. Bill Will Reshape America's Energy Landscape,https://www.nytimes.com/2025/07/03/climate/congress-bill-energy.html,The giant policy bill muscled through Congress by Republicans is poised to remake American energy by slashing tax breaks for wind and solar ...,,1,Republican energy independence and domestic production,pro_republican,republican_perspective,2025-07-08T19:24:08.079304
"Republican platform heavy on energy, silent on climate - E&E News",https://www.eenews.net/articles/republican-platform-heavy-on-energy-silent-on-climate/,"“Republicans will unleash Energy Production from all sources, including nuclear, to immediately slash Inflation and power American homes, cars, ...",,2,Republican energy independence and domestic production,pro_republican,republican_perspective,2025-07-08T19:24:08.079327
Securing Cleaner American Energy Agenda,https://republicans-energycommerce.house.gov/securing-cleaner-american-energy-agenda,"The House Energy and Commerce Republican agenda will protect jobs, energy reliability, and America's national security from the Left's rush to green and ...",,3,Republican energy independence and domestic production,pro_republican,republican_perspective,2025-07-08T19:24:08.079330
House Republicans Unleash Domestic Energy and American ...,https://naturalresources.house.gov/news/documentsingle.aspx?DocumentID=415766,Today we delivered wins for American families and workers as we passed solutions supporting domestic energy production and independence.,,4,Republican energy independence and domestic production,pro_republican,republican_perspective,2025-07-08T19:24:08.079333
"Republicans' views of climate change, energy issues",https://www.pewresearch.org/short-reads/2024/03/01/how-republicans-view-climate-change-and-energy-issues/,"By a 58% to 42% margin, Republicans say expanding production from fossil fuel sources like oil and gas is a greater priority for the country ...",,5,Republican energy independence and domestic production,pro_republican,republican_perspective,2025-07-08T19:24:08.079335
Fact-Checking the Republican National Convention on Energy Claims,https://www.nytimes.com/2024/07/16/climate/fact-checking-rnc-energy.html,"The phrase “energy independence” suggests that the United States was self-sufficient under the Trump administration when it came to energy, ...",,6,Republican energy independence and domestic production,pro_republican,republican_perspective,2025-07-08T19:24:08.079338
Assessing the Impact of the Republican Trifecta on the Energy Industry,https://www.pillsburylaw.com/en/news-and-insights/trump-energy-industry.html,The incoming Trump Administration will prioritize domestic energy production—including critical minerals—and support technologies that make the ...,,7,Republican energy independence and domestic production,pro_republican,republican_perspective,2025-07-08T19:24:08.079340
Wicker Backs Energy Independence Agenda,https://www.wicker.senate.gov/2025/2/wicker-backs-energy-independence-agenda,"Two trends make domestic production an urgent priority. The first is the high cost of energy, which is burdening all of us.",,8,Republican energy independence and domestic production,pro_republican,republican_perspective,2025-07-08T19:24:08.079342
"The One Big, Beautiful Bill Act Endangers the Transformation of ...",https://www.americanprogress.org/article/the-one-big-beautiful-bill-act-endangers-the-transformation-of-contaminated-sites-for-clean-energy-production/,"However, the Republican-authored tax bill that President Donald Trump signed into law on July 4, 2025, enacts sweeping cuts to energy industries ...",,9,Republican energy independence and domestic production,pro_republican,republican_perspective,2025-07-08T19:24:08.079345
What a Republican Trifecta Means for Water Power in 2025,https://www.hydro.org/powerhouse/article/what-to-expect-for-u-s-water-power-in-2025/,"Republicans often frame energy policy within the context of national security, emphasizing the need for a resilient and independent energy ...",,10,Republican energy independence and domestic production,pro_republican,republican_perspective,2025-07-08T19:24:08.079347
The Big Lie that Conservative Policies Are Good for Small Business,https://www.americanprogress.org/article/big-lie-conservative-policies-good-small-business/,President Trump and House Republicans are arguing for huge tax breaks under the premise that they will help small businesses and the economy ...,,1,Small business policies from Republican perspective,pro_republican,republican_perspective,2025-07-08T19:24:10.436217
Democrat and Republican Small Business Owners Agree,https://afeusa.org/articles/democrat-and-republican-small-business-owners-agree/,"Almost three-quarters (73%) believe these policies favor large companies over small businesses. This sentiment spans political affiliations, ...",,2,Small business policies from Republican perspective,pro_republican,republican_perspective,2025-07-08T19:24:10.436242
Republican Views on Small Business,https://www.republicanviews.org/republican-views-on-small-business/,"Republicans, as the party of fewer government controls, seek to alleviate these concerns by giving small businesses more autonomy in these areas ...",,3,Small business policies from Republican perspective,pro_republican,republican_perspective,2025-07-08T19:24:10.436246
Do Republicans support big business or small businesses? - Quora,https://www.quora.com/Do-Republicans-support-big-business-or-small-businesses,They support business—period! Business provides employment allowing all of us the opportunity to support our families and contribute to the ...,,4,Small business policies from Republican perspective,pro_republican,republican_perspective,2025-07-08T19:24:10.436249
SMALL BUSINESSES SHARE HOW HARMFUL REPUBLICAN ...,https://wassermanschultz.house.gov/news/documentsingle.aspx?DocumentID=3333,"The committee heard from small business owners on how Republican schemes raise their costs and make it difficult to budget, plan or make ends ...",,5,Small business policies from Republican perspective,pro_republican,republican_perspective,2025-07-08T19:24:10.436252
Republican Agenda's “Triple Threat” to Low- and Moderate-Income ...,https://www.cbpp.org/research/federal-tax/republican-agendas-triple-threat-to-low-and-moderate-income-family-well-being,"This three-part agenda — legislation, executive action, and tariffs — will reduce the living standards and raise costs for millions of ...",,6,Small business policies from Republican perspective,pro_republican,republican_perspective,2025-07-08T19:24:10.436255
Is the Republican Party Still Pro-Business? - Public Affairs Council,https://pac.org/impact/with-friends-like-these,"First, many companies are supporting campaigns to achieve racial justice, protect LGBTQ+ rights, maintain free and fair elections, reform immigration laws, ...",,7,Small business policies from Republican perspective,pro_republican,republican_perspective,2025-07-08T19:24:10.436259
How businesses and manufacturers will benefit from Trump's big bill,https://www.pbs.org/newshour/show/how-businesses-and-manufacturers-will-benefit-from-trumps-big-bill,Among the big winners with President Trump's bill are corporations and small businesses. The bill would make permanent the tax breaks from ...,,8,Small business policies from Republican perspective,pro_republican,republican_perspective,2025-07-08T19:24:10.436262
Republican and Democratic Approaches to Regulating the Economy,https://www.investopedia.com/ask/answers/regulating-economy.asp,Republican politicians are generally considered business-friendly and in favor of limited government regulation of the economy. This means ...,,9,Small business policies from Republican perspective,pro_republican,republican_perspective,2025-07-08T19:24:10.436264
"Senate Republicans push for laws to aid small business, retail ...",https://www.cnbc.com/2022/04/04/senate-republicans-push-for-new-capital-formation-laws.html,Senate Republicans unveiled a plan to spur business by tailoring regulation and ensuring retail investors have access to young ventures.,,10,Small business policies from Republican perspective,pro_republican,republican_perspective,2025-07-08T19:24:10.436267
"House Republicans Defund Law Enforcement, Make America Less ...",http://democrats-appropriations.house.gov/news/press-releases/house-republicans-defund-law-enforcement-make-america-less-safe,"The legislation defunds law enforcement, makes us less safe, and hurts our economy. For 2025, the bill provides $80.5 billion, a decrease of $1.3 billion – 2 ...",,1,Law enforcement support in Republican governance,pro_republican,republican_perspective,2025-07-08T19:24:12.791670
White Police Membership in Republican Party Associated with ...,https://www.asanet.org/white-police-membership-in-republican-party-associated-with-racial-bias-study-finds/,The findings ultimately show that membership in the Republican Party is associated with racial bias among White officers.,,2,Law enforcement support in Republican governance,pro_republican,republican_perspective,2025-07-08T19:24:12.791697
"Republicans Defund Law Enforcement, Hurt Communities ...",http://democrats-appropriations.house.gov/news/press-releases/republicans-defund-law-enforcement-hurt-communities-advantage-tax-cheats-in-2024,"The bill cuts $22 billion from Internal Revenue Service (IRS) enforcement and operations support, providing tens of billions of dollars in tax breaks.",,3,Law enforcement support in Republican governance,pro_republican,republican_perspective,2025-07-08T19:24:12.791701
"The Republican Recap: Week of May 12, 2025 - Majority Leader",https://www.majorityleader.gov/news/documentsingle.aspx?DocumentID=4520,"House Republicans passed legislation to permit federal law enforcement to purchase their retired weapons, allowing agencies and taxpayers to ...",,4,Law enforcement support in Republican governance,pro_republican,republican_perspective,2025-07-08T19:24:12.791704
H. Rept. 118-57 - EXPRESSING SUPPORT FOR LOCAL LAW ...,https://www.congress.gov/committee-report/118th-congress/house-report/57/1,"In fact, police forces in Democratic-run cities are 75% larger than police forces in GOP-run cities. And Democrats spend roughly 38% more per person on policing ...",,5,Law enforcement support in Republican governance,pro_republican,republican_perspective,2025-07-08T19:24:12.791707
