title,url,snippet,source,position,search_query,category,perspective,collection_timestamp
Police departments across the US tend to be more Republican ...,https://www.reddit.com/r/science/comments/1j0yyo4/police_departments_across_the_us_tend_to_be_more/,"Police departments across the US tend to be more Republican-leaning than the communities they serve, according to a new study.",,6,Law enforcement support in Republican governance,pro_republican,republican_perspective,2025-07-08T19:24:12.791710
Republicans look to eliminate armed law enforcement at some ...,https://www.govexec.com/management/2023/07/republicans-look-eliminate-armed-law-enforcement-some-agencies/388249/,"A group of Republican lawmakers want to eliminate armed law enforcement from a handful of agencies, saying the employees are unnecessary and infringe on the ...",,7,Law enforcement support in Republican governance,pro_republican,republican_perspective,2025-07-08T19:24:12.791713
House G.O.P. Pushes Deep Cuts to Federal Law Enforcement,https://www.nytimes.com/2024/06/26/us/politics/gop-spending-cuts-law-enforcement.html,"For now, top Republicans have settled for using the Justice Department bill to make broad cuts to law enforcement agencies, but some hard-right ...",,8,Law enforcement support in Republican governance,pro_republican,republican_perspective,2025-07-08T19:24:12.791716
Militarization | Cato Institute,https://www.cato.org/policing-in-america/chapter-4/militarization,"A majority of Republicans (65%) support police using military weapons and armored vehicles, while majorities of Democrats (60%) and independents (60%) oppose.",,9,Law enforcement support in Republican governance,pro_republican,republican_perspective,2025-07-08T19:24:12.791718
Democrats and Republicans on K-12 education: A comparison,https://www.brookings.edu/articles/democrats-and-republicans-on-k-12-education-a-comparison/,"The platforms of the Democratic and Republican parties, along with the education-related portions of Project 2025, provide a glimpse of where K-12 education ...",,1,Republican position on education curriculum oversight,pro_republican,republican_perspective,2025-07-08T19:24:15.249857
Republicans Preview Their Education Priorities in a Second Trump ...,https://www.edweek.org/policy-politics/republicans-preview-their-education-priorities-in-a-second-trump-term/2024/12,A House of Representatives education subcommittee on Wednesday laid the groundwork of what could be a Republican Party focus when it controls both chambers of ...,,2,Republican position on education curriculum oversight,pro_republican,republican_perspective,2025-07-08T19:24:15.249885
Where do the Republican candidates stand on education?,https://fordhaminstitute.org/national/commentary/where-do-republican-candidates-stand-education,"What do the websites of the top six GOP candidates for president—Trump, Haley, DeSantis, Ramaswamy, Christie, and Scott—say?",,3,Republican position on education curriculum oversight,pro_republican,republican_perspective,2025-07-08T19:24:15.249890
'Critical race theory' takes heat from GOP lawmakers on House ...,https://georgiarecorder.com/2024/12/04/repub/critical-race-theory-takes-heat-from-gop-lawmakers-on-house-education-panel/,Republican lawmakers railed against what they called “woke” curriculum in schools during a Wednesday hearing in a US House education panel.,,4,Republican position on education curriculum oversight,pro_republican,republican_perspective,2025-07-08T19:24:15.249893
House Republicans Try to Eliminate Public Education that Makes ...,http://democrats-appropriations.house.gov/news/press-releases/house-republicans-try-eliminate-public-education-makes-american-dream-possible,"House Appropriations Committee Republicans today released the draft fiscal year 2025 Labor, Health and Human Services, Education, ...",,5,Republican position on education curriculum oversight,pro_republican,republican_perspective,2025-07-08T19:24:15.249896
Partisan divides over K-12 education in 8 charts,https://www.pewresearch.org/short-reads/2023/06/05/partisan-divides-over-k-12-education-in-8-charts/,"K-12 education is shaping up to be a key issue in the 2024 election cycle. Several prominent Republican leaders, including GOP presidential ...",,6,Republican position on education curriculum oversight,pro_republican,republican_perspective,2025-07-08T19:24:15.249899
Republicans' love/hate relationship with the Education Department,https://www.npr.org/2025/02/24/nx-s1-5298024/republicans-trump-close-education-department,"President Trump says he wants to close the department, and the Senate is expected to vote soon on the confirmation of Linda McMahon, his nominee to be ...",,7,Republican position on education curriculum oversight,pro_republican,republican_perspective,2025-07-08T19:24:15.249902
What Democrats and Republicans have in common on education ...,https://sutherlandinstitute.org/what-democrats-and-republicans-have-in-common-on-education-curriculum-beliefs/,"Given this divide, empowering parents across the political spectrum through stronger curriculum transparency policies could go a long way in ...",,8,Republican position on education curriculum oversight,pro_republican,republican_perspective,2025-07-08T19:24:15.249905
Controversial education issues still alive in GOP platform - EdSource,https://edsource.org/2024/controversial-education-issues-still-alive-in-gop-platform/715670,Most of the document consists of topics drawn from the culture wars that have roiled many school districts in recent years.,,9,Republican position on education curriculum oversight,pro_republican,republican_perspective,2025-07-08T19:24:15.249908
What Do Republican Voters Want on Higher Education - Third Way,https://www.thirdway.org/memo/what-do-republican-voters-want-on-higher-education,Republicans broadly support several of the programs Congress is targeting for cuts in reconciliation. They also do not want to see student loans ...,,10,Republican position on education curriculum oversight,pro_republican,republican_perspective,2025-07-08T19:24:15.249911
Of Surrender and Sovereignty: A Tale of two Republican Parties,https://www.maciverinstitute.com/perspectives/of-surrender-and-sovereignty-a-tale-of-two-republican-parties,"Treaties, and only treaties ratified by the Senate, allow the nation to make certain obligations, but those obligations cannot breach the ...",,1,American sovereignty in Republican foreign policy,pro_republican,republican_perspective,2025-07-08T19:24:17.607188
Republican Party and US Foreign Relations,https://oxfordre.com/americanhistory/display/10.1093/acrefore/9780199329175.001.0001/acrefore-9780199329175-e-621?d=%2F10.1093%2Facrefore%2F9780199329175.001.0001%2Facrefore-9780199329175-e-621&p=emailA0d5KKdlA.E4w,The history of the Republican Party's foreign policy reminds historians that national politics often entails efforts to hold together a diverse coalition.,,2,American sovereignty in Republican foreign policy,pro_republican,republican_perspective,2025-07-08T19:24:17.607210
Conservative U.S. Statecraft for the 21st Century - Foreign Policy,https://foreignpolicy.com/2022/11/07/us-republicans-conservative-foreign-policy-principles/,"The principles that undergird a conservative foreign policy—the primacy of liberty, national sovereignty, military power, and a realistic ...",,3,American sovereignty in Republican foreign policy,pro_republican,republican_perspective,2025-07-08T19:24:17.607212
[PDF] the united states' stringent sovereignty: how foreign policy framing ...,https://scholarship.claremont.edu/cgi/viewcontent.cgi?article=3178&context=scripps_theses,"This thesis intends to illuminate the convoluted relationship between the moral framing of political issues, the subsequent perception of threat.",,4,American sovereignty in Republican foreign policy,pro_republican,republican_perspective,2025-07-08T19:24:17.607213
Hard Line: The Republican Party and U.S. Foreign Policy since ...,https://www.amazon.com/Hard-Line-Republican-Foreign-Policy/dp/0691141827,Hard Line traces the history of Republican Party foreign policy since World War II by focusing on the conservative leaders who shaped it.,,5,American sovereignty in Republican foreign policy,pro_republican,republican_perspective,2025-07-08T19:24:17.607214
Conservative Nationalism and US Foreign Policy - AEI,https://www.aei.org/articles/conservative-nationalism-and-us-foreign-policy/,"Thomas Jefferson and Alexander Hamilton agreed on American exceptionalism, US sovereignty, and the long-term expansion of republican governments ...",,6,American sovereignty in Republican foreign policy,pro_republican,republican_perspective,2025-07-08T19:24:17.607215
America's Founders and the Principles of Foreign Policy,https://www.heritage.org/political-process/report/americas-founders-and-the-principles-foreign-policy-sovereign-independence,"America's Founders and the Principles of Foreign Policy: Sovereign Independence, National Interests, and the Cause of Liberty in the World.",,7,American sovereignty in Republican foreign policy,pro_republican,republican_perspective,2025-07-08T19:24:17.607217
History of foreign policy and national defense in the Republican Party,https://en.wikipedia.org/wiki/History_of_foreign_policy_and_national_defense_in_the_Republican_Party,The Republican Party of the United States has held a variety of views on foreign policy and national defense over the course of its existence.,,8,American sovereignty in Republican foreign policy,pro_republican,republican_perspective,2025-07-08T19:24:17.607218
[PDF] Divided We Stand - Chicago Council on Global Affairs,https://globalaffairs.org/sites/default/files/2020-12/report_2020ccs_americadivided_0.pdf,Republican views in favor of self-sufficiency are a function of their commitment to upholding US independence and sovereignty in international affairs.,,9,American sovereignty in Republican foreign policy,pro_republican,republican_perspective,2025-07-08T19:24:17.607219
Polarised power: The three Republican 'tribes' that could define ...,https://ecfr.eu/article/polarised-power-the-three-republican-tribes-that-could-define-americas-relationship-with-the-world/,"Three Republican 'tribes' are competing to write their next president's US foreign policy. Whether 'restrainers,' 'prioritisers,' or 'primacists' emerge on top ...",,10,American sovereignty in Republican foreign policy,pro_republican,republican_perspective,2025-07-08T19:24:17.607220
