title,url,snippet,source,position,search_query,category,perspective,collection_timestamp
Republican Constitutionalism,https://constitutionalcommentary.lib.umn.edu/article/republican-constitutionalism/,"For a republican constitution on Barnett's account, the fundamental institutions of self-government are judicially-enforceable, liberty-protecting rights and ...",,1,Republican interpretation of constitutional liberties,pro_republican,republican_perspective,2025-07-08T19:23:45.247469
The Partisan Contours of Attitudes About Rights and Liberties - PMC,https://pmc.ncbi.nlm.nih.gov/articles/PMC9883813/,"Because of elite rhetoric, we hypothesize that Republicans are more likely than Democrats to perceive rights violations, often by non-government ...",,2,Republican interpretation of constitutional liberties,pro_republican,republican_perspective,2025-07-08T19:23:45.247508
The Constitution from a Conservative Perspective,https://www.heritage.org/political-process/report/the-constitution-conservative-perspective,"... meaning, scope, and constitutional basis of our liberties. To an alarming degree, the American people are losing control over their own rights and liberties ...",,3,Republican interpretation of constitutional liberties,pro_republican,republican_perspective,2025-07-08T19:23:45.247512
Our Republican Constitution: Securing the Liberty and Sovereignty ...,https://www.amazon.com/Our-Republican-Constitution-Securing-Sovereignty/dp/0062412280,"A concise history of the long struggle between two fundamentally opposing constitutional traditions, from one of the nation's leading constitutional scholars.",,4,Republican interpretation of constitutional liberties,pro_republican,republican_perspective,2025-07-08T19:23:45.247519
Constitutional Interpretation in Republican and Mixed Regimes,https://lawliberty.org/constitutional-interpretation-in-republican-and-mixed-regimes/,"In republican constitutionalism, the people make a firm precommitment to a particular form of governance. Thus, they pass a constitution ...",,5,Republican interpretation of constitutional liberties,pro_republican,republican_perspective,2025-07-08T19:23:45.247522
Red states are remaking the civil liberties landscape | CNN Politics,https://www.cnn.com/2022/02/22/politics/republicans-civil-liberties-abortion-voting-race,"From Florida, Georgia and Tennessee through Texas, South Dakota and Montana, Republican-controlled states are approving a torrent of culturally conservative ...",,6,Republican interpretation of constitutional liberties,pro_republican,republican_perspective,2025-07-08T19:23:45.247526
Republican Constitutionalism | Lawrence B. Solum - UVA Law,https://www.law.virginia.edu/scholarship/publication/lawrence-b-solum/953576,This article develops a new way of understanding the law in order to address contemporary debates about judicial practice and reform.,,7,Republican interpretation of constitutional liberties,pro_republican,republican_perspective,2025-07-08T19:23:45.247529
5 Republican perspectives on constitutional interpretation - De Gruyter,https://www.degruyterbrill.com/document/doi/10.7765/9780719098871.00012/html?srsltid=AfmBOoo_MVM94EffacbGPkoS142oegIZfXplcqowaDcvmNQfn93hukHL,5 Republican perspectives on constitutional interpretation was published in The political theory of the Irish Constitution on page 145.,,8,Republican interpretation of constitutional liberties,pro_republican,republican_perspective,2025-07-08T19:23:45.247532
Republicanism - Stanford Encyclopedia of Philosophy,https://plato.stanford.edu/entries/republicanism/,"Republican freedom merely requires the absence of something, namely, the absence of any structural dependence on arbitrary power or domination.",,9,Republican interpretation of constitutional liberties,pro_republican,republican_perspective,2025-07-08T19:23:45.247535
Creation Role and Purpose of Republican Government,https://billofrightsinstitute.org/essays/republican-government,"A constitutional republic, however, also limits the power of the majority through a framework that promotes competent government and affords protections for ...",,10,Republican interpretation of constitutional liberties,pro_republican,republican_perspective,2025-07-08T19:23:45.247539
Modern Conservative Economic Policies - (AP US Government),https://library.fiveable.me/key-terms/ap-gov/modern-conservative-economic-policies,"These policies prioritize tax cuts, deregulation, and reduced government spending as means to stimulate economic growth and increase efficiency in the economy.",,1,Conservative economic growth and deregulation policies,pro_republican,republican_perspective,2025-07-08T19:23:47.414100
Conservative Economic Policies - (AP US Government) - Fiveable,https://library.fiveable.me/key-terms/ap-gov/conservative-economic-policies,Conservative economic policies often prioritize tax cuts as a means to stimulate economic growth by increasing disposable income for individuals and businesses.,,2,Conservative economic growth and deregulation policies,pro_republican,republican_perspective,2025-07-08T19:23:47.414110
Reducing Regulations Produces Strong Economic Growth Responses,https://www.heritage.org/government-regulation/report/reducing-regulations-produces-strong-economic-growth-responses,This paper presents statistical evidence that reducing regulations is associated with positive and significant gains in economic growth.,,3,Conservative economic growth and deregulation policies,pro_republican,republican_perspective,2025-07-08T19:23:47.414112
Strategic Deregulation to Spur Economic Growth – John O. McGinnis,https://lawliberty.org/strategic-deregulation-to-spur-economic-growth/,"Three central pillars support a coherent deregulatory strategy: transparency, presidential control, and substantive deregulation where permitted ...",,4,Conservative economic growth and deregulation policies,pro_republican,republican_perspective,2025-07-08T19:23:47.414113
"Deregulation: Definition, History, Effects, and Purpose - Investopedia",https://www.investopedia.com/terms/d/deregulate.asp,"Deregulation is the reduction or elimination of government oversight of an industry, usually cited as a way to boost economic growth.",,5,Conservative economic growth and deregulation policies,pro_republican,republican_perspective,2025-07-08T19:23:47.414115
The Impact of Conservatism - Number Analytics,https://www.numberanalytics.com/blog/impact-of-conservatism,"Conservative economic policies typically advocate for lower taxes, reduced government spending, and deregulation. Proponents argue that these ...",,6,Conservative economic growth and deregulation policies,pro_republican,republican_perspective,2025-07-08T19:23:47.414116
The economic & regulatory implications of Trump's 2024 election ...,https://www.thomsonreuters.com/en-us/posts/government/trump-economic-regulatory-implications/,"Deregulation would be a key theme, affecting sectors from energy to finance. While this might spur short-term economic growth by reducing ...",,7,Conservative economic growth and deregulation policies,pro_republican,republican_perspective,2025-07-08T19:23:47.414123
The economic lie: We've been hijacked to believing Republicans are ...,https://www.dailycardinal.com/article/2024/10/the-economic-lie-weve-been-hijacked-to-believing-republicans-are-better-for-the-country,At the core of the Republican economic narrative is a simple and appealing formula: lower taxes and deregulation will lead to more growth.,,8,Conservative economic growth and deregulation policies,pro_republican,republican_perspective,2025-07-08T19:23:47.414125
Conservative Economics | American Compass,https://americancompass.org/conservative-economics/,Conservative economics gives policymakers the tools to understand capitalism and harness its power for the benefit of American workers.,,9,Conservative economic growth and deregulation policies,pro_republican,republican_perspective,2025-07-08T19:23:47.414126
A Brief History of Regulation and Deregulation,https://regulatorystudies.columbian.gwu.edu/brief-history-regulation-and-deregulation,"The “economic regulation” prevalent at that time relied on economic controls, such as price ceilings or floors, quantity restrictions, and service parameters.",,10,Conservative economic growth and deregulation policies,pro_republican,republican_perspective,2025-07-08T19:23:47.414127
The Myth of Limited Government - Yale University Press,https://yalebooks.yale.edu/2023/04/28/the-myth-of-limited-government%EF%BF%BC/,"The call for limited government is a recurring theme in Republican politics. Ronald Reagan's refrain that government is the problem, not the solution, has ...",,1,Republican limited government philosophy,pro_republican,republican_perspective,2025-07-08T19:23:49.856552
7 Core Principles of Conservatism | U.S. Congressman Mike Johnson,https://mikejohnson.house.gov/7-core-principles-of-conservatism/,"2. Limited Government. For individual liberty to be championed, government must be reduced. We believe, as our founders did, that legitimate government operates ...",,2,Republican limited government philosophy,pro_republican,republican_perspective,2025-07-08T19:23:49.856579
The Republican Party - Digestible Notes,https://digestiblenotes.com/politics/parties/republican_party.php,"The Republicans believe in Limited Government. In other words, the Republicans belive in the rights of states, tax cuts and reduced government spending ...",,3,Republican limited government philosophy,pro_republican,republican_perspective,2025-07-08T19:23:49.856583
Why Limited Government | Collin County Republican Party Principles,https://www.collincountygop.org/principles/why-limited-government/,"The principle of limited government is simply a recognition of James Madison's words, “If men were angels, no government would be necessary.”",,4,Republican limited government philosophy,pro_republican,republican_perspective,2025-07-08T19:23:49.856586
Republican party ideologies - (AP US Government) - Fiveable,https://library.fiveable.me/key-terms/ap-gov/republican-party-ideologies,Republican party ideologies embody key principles of conservatism through their advocacy for limited government intervention in both economic and social matters ...,,5,Republican limited government philosophy,pro_republican,republican_perspective,2025-07-08T19:23:49.856589
2. Views of government and the nation - Pew Research Center,https://www.pewresearch.org/politics/2019/12/17/views-of-government-and-the-nation/,"By contrast, most Republicans prefer a limited role for government: 71% of Republicans and Republican leaners say that government is doing too ...",,6,Republican limited government philosophy,pro_republican,republican_perspective,2025-07-08T19:23:49.856592
"""Why I Am A Republican"" | The Ripon Society",https://riponsociety.org/article/why-i-am-a-republican/,"Republicans come from many backgrounds, but we are united by our desires for responsible leadership, principled but limited government, a belief in free markets ...",,7,Republican limited government philosophy,pro_republican,republican_perspective,2025-07-08T19:23:49.856595
Creation Role and Purpose of Republican Government,https://billofrightsinstitute.org/essays/republican-government,"The idea that the United States is a democracy is reinforced in the rhetoric of public officials and within the media, and much of American society currently ...",,8,Republican limited government philosophy,pro_republican,republican_perspective,2025-07-08T19:23:49.856598
"Republican Party | Definition, History, & Beliefs - Britannica",https://www.britannica.com/topic/Republican-Party,"They tend to oppose extensive government regulation of the economy, government-funded social programs, affirmative action, and policies aimed at strengthening ...",,9,Republican limited government philosophy,pro_republican,republican_perspective,2025-07-08T19:23:49.856601
2024 Republican Party Platform - The American Presidency Project,https://www.presidency.ucsb.edu/documents/2024-republican-party-platform,2024 GOP PLATFORM: MAKE AMERICA GREAT AGAIN! Dedication: To the Forgotten Men and Women of America PREAMBLE America First: A Return to Common Sense.,,1,Traditional values in Republican policy platforms,pro_republican,republican_perspective,2025-07-08T19:23:52.106080
Traditional Republican values - NH Business Review,https://www.nhbr.com/traditional-republican-values/,"Will, the conservative writer and commentator, in a June 2 interview in The New York Times Book Review, said, “To understand the Republican ...",,2,Traditional values in Republican policy platforms,pro_republican,republican_perspective,2025-07-08T19:23:52.106107
About Our Party | GOP - Republican National Committee,https://www.gop.com/about-our-party/,,,3,Traditional values in Republican policy platforms,pro_republican,republican_perspective,2025-07-08T19:23:52.106112
Presidential Elections and the American Political System,https://dk.usembassy.gov/usa-i-skolen/presidential-elections-and-the-american-political-system/,Political Parties in America · The Two-Party System and Two Major Parties · History of Democratic and Republican Party · The Structure of the U.S. Political System.,,4,Traditional values in Republican policy platforms,pro_republican,republican_perspective,2025-07-08T19:23:52.106115
GOP battles over party's traditional values and those of Trump,https://news.harvard.edu/gazette/story/2021/04/gop-battles-over-partys-traditional-values-and-those-of-trump/,"Why are so many elected members of the Republican Party still following Trump? Self-preservation, said Tim Alberta, who covered Republican ...",,5,Traditional values in Republican policy platforms,pro_republican,republican_perspective,2025-07-08T19:23:52.106118
"Both Republicans and Democrats prioritize family, but they differ ...",https://www.pewresearch.org/short-reads/2021/11/22/both-republicans-and-democrats-prioritize-family-but-they-differ-over-other-sources-of-meaning-in-life/,"Republicans, along with independents who lean to the Republican Party, are much more likely than Democrats and Democratic-leaning independents ...",,6,Traditional values in Republican policy platforms,pro_republican,republican_perspective,2025-07-08T19:23:52.106121
What exactly are democratic and republican values? : r/PoliticalDebate,https://www.reddit.com/r/PoliticalDebate/comments/1fqm3w1/what_exactly_are_democratic_and_republican_values/,"27 votes, 239 comments. I'm really getting tired of the same he-said she-said type of political debates I've been having with folks on ...",,7,Traditional values in Republican policy platforms,pro_republican,republican_perspective,2025-07-08T19:23:52.106124
"Republican Party | Definition, History, & Beliefs - Britannica",https://www.britannica.com/topic/Republican-Party,"Republican Party, one of the two major political parties, alongside the Democratic Party, in the United States. Also known as the Grand Old Party, or GOP, ...",,8,Traditional values in Republican policy platforms,pro_republican,republican_perspective,2025-07-08T19:23:52.106127
Republican Party Platform of 1928 | The American Presidency Project,https://www.presidency.ucsb.edu/documents/republican-party-platform-1928,"The Republican Party in national convention assembled presents to the people of the Nation this platform of its principles, based on a record of its ...",,9,Traditional values in Republican policy platforms,pro_republican,republican_perspective,2025-07-08T19:23:52.106130
Religious Liberty Used to Uphold Conservative Religious Privileges,https://www.americanbar.org/groups/crsj/resources/human-rights/archive/religious-liberty-used-uphold-conservative-religious-privileges/,A recurring target of the religious refusal complex that has arisen on the back of this conception of “religious liberty” is the health-care industry.,,1,Religious liberty protections advocated by Republicans,pro_republican,republican_perspective,2025-07-08T19:23:54.566352
"Georgia Republicans say religious liberty needs protection, but ...",https://apnews.com/article/georgia-religious-liberty-freedom-discrimination-lgbtq-cd902d2ac37b9f6bb1c10de0caf853d3,"Georgia Republicans are voting to protect religious rights from being trampled by state and local governments, while Democrats warn that the long-disputed ...",,2,Religious liberty protections advocated by Republicans,pro_republican,republican_perspective,2025-07-08T19:23:54.566385
Republicans introduce bill to protect LGBTQ rights and religious ...,https://www.ncronline.org/news/republicans-introduce-bill-protect-lgbtq-rights-and-religious-freedom,"That bill included broad protections for the LGBTQ community but few exemptions for churches, schools and charities that object to homosexuality ...",,3,Religious liberty protections advocated by Republicans,pro_republican,republican_perspective,2025-07-08T19:23:54.566390
Who is best suited to protect religious liberty? It may depend on ...,https://www.thearda.com/categories/ahead-of-the-trend/who-is-best-suited-to-protect-religious-liberty-it-may-depend-on-whom-you-voted-for,"By comparison, 35% of Republicans believed that the president was a defender of the rights of religious Americans.",,4,Religious liberty protections advocated by Republicans,pro_republican,republican_perspective,2025-07-08T19:23:54.566393
"Conservatives Call For 'Religious Freedom,' But For Whom? - NPR",https://www.npr.org/2015/12/11/458969192/conservatives-call-for-religious-freedom-but-for-whom,"Republican presidential candidates decry what they call a ""war on faith."" Religious conservatives say they face anti-Christian bigotry.",,5,Religious liberty protections advocated by Republicans,pro_republican,republican_perspective,2025-07-08T19:23:54.566396
In Bad Faith: How Conservatives Are Weaponizing “Religious ...,https://www.guttmacher.org/gpr/2018/05/bad-faith-how-conservatives-are-weaponizing-religious-liberty-allow-institutions,"Social conservatives have fought for extensive religious and moral exemptions for health care, educational, social service and other institutions.",,6,Religious liberty protections advocated by Republicans,pro_republican,republican_perspective,2025-07-08T19:23:54.566399
Are Republicans against religious freedom? - Quora,https://www.quora.com/Are-Republicans-against-religious-freedom,"Republicans are always promoting the idea that they are for religious freedom, but they promote these double standards where the rights of ...",,7,Religious liberty protections advocated by Republicans,pro_republican,republican_perspective,2025-07-08T19:23:54.566402
Religious Liberty Should Do No Harm - Center for American Progress,https://www.americanprogress.org/article/religious-liberty-no-harm/,Policymakers should ensure that religious liberty extends to all Americans—and that it is not misused as a license to discriminate.,,8,Religious liberty protections advocated by Republicans,pro_republican,republican_perspective,2025-07-08T19:23:54.566405
Religious Liberty in the States – Mark David Hall & Paul Mueller,https://lawliberty.org/religious-freedom-in-the-states/,The RLS project uses 39 objective indicators to evaluate the success of each US state in safeguarding religious freedom.,,9,Religious liberty protections advocated by Republicans,pro_republican,republican_perspective,2025-07-08T19:23:54.566408
Georgia's 'religious liberty' measure is back on track with GOP support,https://www.ajc.com/politics/georgias-religious-liberty-measure-is-back-on-track-with-gop-support/2GEREAXJXNDZZPTN4UIFRXORFY/,The Republican-backed push to pass “religious liberty” legislation seems back on a fast-track Wednesday after a House committee cleared the legislation.,,10,Religious liberty protections advocated by Republicans,pro_republican,republican_perspective,2025-07-08T19:23:54.566410
House Republicans Lead on Health Care Reforms,https://energycommerce.house.gov/posts/house-republicans-lead-on-health-care-reforms,"House Republicans have led on major legislative initiatives to improve the health, safety, and wellbeing of the American people while preserving their freedoms.",,1,Market-based healthcare reforms from Republicans,pro_republican,republican_perspective,2025-07-08T19:23:57.021642
Republican Health Coverage Proposals Would Increase Number of ...,https://www.cbpp.org/research/health/republican-health-coverage-proposals-would-increase-number-of-uninsured-raise,The RSC and HBC plans would raise people's costs in the ACA marketplaces by reducing the financial assistance that most marketplace enrollees ...,,2,Market-based healthcare reforms from Republicans,pro_republican,republican_perspective,2025-07-08T19:23:57.021671
"House Republicans' Big, 'Beautiful' Bill Would Make Health Care ...",https://www.americanprogress.org/article/house-republicans-big-beautiful-bill-would-make-health-care-more-expensive-for-americans-with-medicare-and-other-insurance/,The House Republican-passed budget bill includes a number of provisions that would make ACA marketplace plans more expensive and less accessible ...,,3,Market-based healthcare reforms from Republicans,pro_republican,republican_perspective,2025-07-08T19:23:57.021675
Summary of Health Care Provisions in the “One Big Beautiful Bill Act”,https://www.bhfs.com/insight/summary-of-health-care-provisions-in-the-one-big-beautiful-bill-act/,"Collectively, these provisions reflect a Republican strategy focused on limiting federal health spending, enforcing eligibility requirements and ...",,4,Market-based healthcare reforms from Republicans,pro_republican,republican_perspective,2025-07-08T19:23:57.021678
Republican and Democratic platforms on health care - PNHP,https://pnhp.org/news/republican-and-democratic-platforms-on-health-care/,2016 Republican Platform · Restoring Patient Control and Preserving Quality in Healthcare · Preserving Medicare and Medicaid · Covering All Americans and Providing ...,,5,Market-based healthcare reforms from Republicans,pro_republican,republican_perspective,2025-07-08T19:23:57.021681
President Donald Trump healthcare agenda - PwC,https://www.pwc.com/us/en/industries/health-industries/library/election-2024-trump-health-agenda.html,The Trump administration and the GOP have outlined a series of health policy initiatives aimed at reshaping the role of government in the health ...,,6,Market-based healthcare reforms from Republicans,pro_republican,republican_perspective,2025-07-08T19:23:57.021684
"House Republican Health Agenda Cuts Coverage, Raises People's ...",https://www.cbpp.org/research/health/house-republican-health-agenda-cuts-coverage-raises-peoples-costs,15 million low- and moderate-income people would lose health coverage and become uninsured under the House Republicans' sweeping and draconian health care ...,,7,Market-based healthcare reforms from Republicans,pro_republican,republican_perspective,2025-07-08T19:23:57.021687
More On Health and Politics: The Peculiar Timing of Republican ...,https://www.kff.org/from-drew-altman/more-on-health-and-politics-the-peculiar-timing-of-republican-health-policy-plans/,Republican health policy proposals seem to fall into two categories: Scalpels and sledgehammers. There are more modest ideas like promoting Health Savings ...,,8,Market-based healthcare reforms from Republicans,pro_republican,republican_perspective,2025-07-08T19:23:57.021690
Medicare Physician Payment: The Case for Market-Based Reforms,https://www.heritage.org/health-care-reform/report/medicare-physician-payment-the-case-market-based-reforms,"Almost annually, physicians face the prospect of Medicare payment cuts unless Congress intervenes to block or modify them.",,9,Market-based healthcare reforms from Republicans,pro_republican,republican_perspective,2025-07-08T19:23:57.021693
The Impact of U.S. Election and Healthcare Politics on Company ...,https://w3ins.com/news/healthcare-politics/,Republicans have tended to favor market competition to reduce prices without heavy government intervention. Healthcare Politics in the 2024 ...,,10,Market-based healthcare reforms from Republicans,pro_republican,republican_perspective,2025-07-08T19:23:57.021696
How the Republican spending bill super-charges immigration ...,https://www.reuters.com/world/us/how-republican-spending-bill-super-charges-immigration-enforcement-2025-07-02/,"The measure gives $4.1 billion to hire more CBP personnel, including Border Patrol agents. REIMBURSEMENTS TO STATES. The bill creates a $10 ...",,1,Republican border security and immigration enforcement,pro_republican,republican_perspective,2025-07-08T19:23:59.277978
Big Beautiful Border Security! - House Judiciary Committee,http://judiciary.house.gov/media/press-releases/big-beautiful-border-security,President Trump and House Republicans are committed to restoring immigration integrity and enhancing national security.,,2,Republican border security and immigration enforcement,pro_republican,republican_perspective,2025-07-08T19:23:59.278010
GOP bill would grant Trump right to deploy National Guard for ...,https://harrigan.house.gov/media/in-the-news/fox-news-gop-bill-would-grant-trump-right-deploy-national-guard-immigration,"FIRST ON FOX—New legislation aims to codify the president's authority to deploy National Guard units for immigration enforcement, ...",,3,Republican border security and immigration enforcement,pro_republican,republican_perspective,2025-07-08T19:23:59.278014
How the GOP spending bill will fund immigration enforcement - Axios,https://www.axios.com/2025/07/03/immigration-spending-increases-trump-big-beautiful-bill,The bill allocates more than $100 billion to ICE and border enforcement through September 2029.,,4,Republican border security and immigration enforcement,pro_republican,republican_perspective,2025-07-08T19:23:59.278017
